{
  "architecture": "CAPABILITY_FIRST_EXTERNAL_DEPENDENCIES",
  "audit_scope": "ALL_TRACKED_SOURCE_TEST_GOVERNANCE_SCHEMA_RELEASE_INSTALLER_DOCUMENTATION_FILES",
  "dependencies": [
    {
      "audit_patterns": [
        "Home Assistant Core",
        "ha_version",
        "CORE_TAG",
        "core_source_reference",
        "ha core",
        "homeassistant/core"
      ],
      "automatic_continuation_after_version_drift": true,
      "changed_version_alone_can_fail": false,
      "compatibility_baseline": "2026.8.1",
      "compatibility_probe": "Prepared producer validates bounded auth envelopes then the four read-only commands, correlated results and required fields/types. No live execution in this checkpoint.",
      "dependency_class": "A",
      "dependency_id": "ha_core",
      "display_name": "Home Assistant Core",
      "exact_version": null,
      "failure_isolation": "PE-4 Home Assistant Association",
      "operator_remediation": "Review the named dependency contract; restore capability or authorize a governed trust refresh.",
      "optional_capabilities": [],
      "owner_system": "external software or protocol owner",
      "policy": "capability-based",
      "required_capabilities": [
        "version_metadata",
        "authentication",
        "device_registry",
        "entity_registry",
        "area_registry",
        "config_entries"
      ],
      "schema_protocol_expectations": "Four approved read commands, strict JSON, mandatory field core and recognized types; unknown optional fields counted, never exposed. HA release token informational.",
      "security_provenance_requirements": "preserve governed identities, credentials and transport trust; never auto-adopt identity drift",
      "used_by_components": [
        "PE-4 Home Assistant Association"
      ],
      "version_discovery_method": "bounded sanitized HA WebSocket greeting",
      "version_role": "informational"
    },
    {
      "audit_patterns": [
        "config/device_registry",
        "config/entity_registry",
        "config/area_registry",
        "config_entries/get",
        "auth_required",
        "auth_ok",
        "WebSocket",
        "websocket_api"
      ],
      "automatic_continuation_after_version_drift": true,
      "changed_version_alone_can_fail": false,
      "compatibility_baseline": null,
      "compatibility_probe": "Same producer checked_result and Reducer validate IDs, success, bounded lists, mandatory fields and recognized types; additive fields are reduced to counts.",
      "dependency_class": "E",
      "dependency_id": "ha_registry_schema",
      "display_name": "Home Assistant WebSocket registry schema",
      "exact_version": null,
      "failure_isolation": "PE-4 Home Assistant Association",
      "operator_remediation": "Review the named dependency contract; restore capability or authorize a governed trust refresh.",
      "optional_capabilities": [],
      "owner_system": "external software or protocol owner",
      "policy": "capability-based",
      "required_capabilities": [
        "correlated_results"
      ],
      "schema_protocol_expectations": "Integer correlation; one result per command; auth envelope; bounded arrays/objects; no unsafe widening.",
      "security_provenance_requirements": "preserve governed identities, credentials and transport trust; never auto-adopt identity drift",
      "used_by_components": [
        "PE-4 Home Assistant Association"
      ],
      "version_discovery_method": "optional sanitized producer observation; no automatic version command or network probe",
      "version_role": "informational"
    },
    {
      "audit_patterns": [
        "value_json",
        "state_topic",
        "availability_topic",
        "json_attributes_topic",
        "value_template",
        "states\\(",
        "state_attr\\(",
        "binary_sensor\\.",
        "sensor\\.",
        "homeassistant/packages"
      ],
      "automatic_continuation_after_version_drift": true,
      "changed_version_alone_can_fail": false,
      "compatibility_baseline": null,
      "compatibility_probe": "At an authorized consumer boundary, validate yaml_templates against HA package YAML, MQTT state/attribute keys, entity names, Jinja templates; ha core check is applicable execution probe. No new host probe is scheduled; compatibility remains unknown without observation.",
      "dependency_class": "E",
      "dependency_id": "ha_yaml",
      "display_name": "Home Assistant YAML and template/MQTT integration",
      "exact_version": null,
      "failure_isolation": "Home Assistant dashboard and telemetry",
      "operator_remediation": "Review the named dependency contract; restore capability or authorize a governed trust refresh.",
      "optional_capabilities": [],
      "owner_system": "external software or protocol owner",
      "policy": "capability-based",
      "required_capabilities": [
        "yaml_templates"
      ],
      "schema_protocol_expectations": "HA package YAML, MQTT state/attribute keys, entity names, Jinja templates; ha core check is applicable execution probe.",
      "security_provenance_requirements": "preserve governed identities, credentials and transport trust; never auto-adopt identity drift",
      "used_by_components": [
        "Home Assistant dashboard and telemetry"
      ],
      "version_discovery_method": "optional sanitized producer observation; no automatic version command or network probe",
      "version_role": "informational"
    },
    {
      "audit_patterns": [
        "/config",
        "HA_CONFIG",
        "command -v ha",
        "ha core"
      ],
      "automatic_continuation_after_version_drift": true,
      "changed_version_alone_can_fail": false,
      "compatibility_baseline": null,
      "compatibility_probe": "At an authorized consumer boundary, validate config_mount, core_check against Configurable HA_CONFIG, readable/writable package directory and core-check command; OS version alone never gates. No new host probe is scheduled; compatibility remains unknown without observation.",
      "dependency_class": "A",
      "dependency_id": "ha_config_path",
      "display_name": "Home Assistant config mount and CLI",
      "exact_version": null,
      "failure_isolation": "Home Assistant installation",
      "operator_remediation": "Review the named dependency contract; restore capability or authorize a governed trust refresh.",
      "optional_capabilities": [],
      "owner_system": "external software or protocol owner",
      "policy": "capability-based",
      "required_capabilities": [
        "config_mount",
        "core_check"
      ],
      "schema_protocol_expectations": "Configurable HA_CONFIG, readable/writable package directory and core-check command; OS version alone never gates.",
      "security_provenance_requirements": "preserve governed identities, credentials and transport trust; never auto-adopt identity drift",
      "used_by_components": [
        "Home Assistant installation"
      ],
      "version_discovery_method": "optional sanitized producer observation; no automatic version command or network probe",
      "version_role": "informational"
    },
    {
      "audit_patterns": [
        "Pi-hole",
        "pihole",
        "pi-hole",
        "FTL"
      ],
      "automatic_continuation_after_version_drift": true,
      "changed_version_alone_can_fail": false,
      "compatibility_baseline": null,
      "compatibility_probe": "At an authorized consumer boundary, validate lease_source against FTL service name and optional package observation; ingestion shape isolated separately. No FTL API client exists here. No new host probe is scheduled; compatibility remains unknown without observation.",
      "dependency_class": "A",
      "dependency_id": "pihole_ftl",
      "display_name": "Pi-hole FTL",
      "exact_version": null,
      "failure_isolation": "inventory and DNS observations",
      "operator_remediation": "Review the named dependency contract; restore capability or authorize a governed trust refresh.",
      "optional_capabilities": [],
      "owner_system": "external software or protocol owner",
      "policy": "capability-based",
      "required_capabilities": [
        "lease_source"
      ],
      "schema_protocol_expectations": "FTL service name and optional package observation; ingestion shape isolated separately. No FTL API client exists here.",
      "security_provenance_requirements": "preserve governed identities, credentials and transport trust; never auto-adopt identity drift",
      "used_by_components": [
        "inventory and DNS observations"
      ],
      "version_discovery_method": "optional sanitized producer observation; no automatic version command or network probe",
      "version_role": "informational"
    },
    {
      "audit_patterns": [
        "dhcp.leases",
        "dnsmasq.leases",
        "dhcpd.leases",
        "lease_expires",
        "dhcp_lease",
        "dnsmasq"
      ],
      "automatic_continuation_after_version_drift": true,
      "changed_version_alone_can_fail": false,
      "compatibility_baseline": null,
      "compatibility_probe": "Existing capture_dhcp_lease_snapshot classifies found/empty/malformed/partial/unsupported/missing/unreadable/io_error; lease_observation converts those classifications without rereading household data.",
      "dependency_class": "E",
      "dependency_id": "pihole_leases",
      "display_name": "Pi-hole/dnsmasq DHCP lease format",
      "exact_version": null,
      "failure_isolation": "passive DHCP inventory",
      "operator_remediation": "Review the named dependency contract; restore capability or authorize a governed trust refresh.",
      "optional_capabilities": [],
      "owner_system": "external software or protocol owner",
      "policy": "capability-based",
      "required_capabilities": [
        "lease_columns"
      ],